name,address1,address2,city,state,zip,phone,type,url
"Carlsberg Hong Kong Limited","1/F Delta House, 3 On Yiu Street, Siu Lek Yuen,","Shatin, New Territories, Hong Kong",,,,+85231898000,large,http://www.carlsberg.com
"Hong Kong Beer Co.","Unit A, G/F, Wah Shing Centre, 5 Fung Yi","Hong Kong, Hong Kong",,,,"852 2580 2360",micro,http://www.hkbeerco.com
"Lion Rock Brewery Limited","Unit 2, 14/F, Man Shing Industrial Build","Hong Kong, Hong Kong",,,,(852)95484205,micro,http://www.lionrockbeers.com
"Lucky Dawgs Brewing Co. Ltd. Hong Kong",,"Hong Kong, Hong Kong",,,,"852 9402 7988",planning,http://www.luckydawgsbrewing.com
"San Miguel Brewery Inc","22 Wang Lee Street Yuen Long Industrial Estate","New Territories, Hong Kong",,,,"852-2486 7368",large,
"San Miguel Brewery Inc","22 Wang Lee Street Yuen Long Industrial Estate","New Territories, Hong Kong",,,,"852-2486 7368",large,
"San Miguel Brewery Inc","22 Wang Street Yuen Long Industrial Estate","New Territories, Hong Kong",,,,"852-2486 7368",large,
"Young Master Ales","G/F Sungib Industrial Centre 53 Wong Chuk Hang Road","Hong Kong, Hong Kong",,,,,micro,http://www.youngmasterales.com
